image_path,caption
images/img_218.jpg,"Current Sports News - Khel Dekho: Asia Cup 2018: With Problems Aplenty,  India Have Much to Get Right Tonight Against Pakistan"
images/img_219.jpg,Cricket should support other sports in India. I wrote about this two weeks  ago. Some supported and others critiqued. Yesterday BCCI announced a 8.5cr  support to Indian athletes going to Paris… |
images/img_220.jpg,"Sports News Today: Sports News, Latest News on Sports, Breaking News and  Trending Stories - Firstpost"
images/img_221.jpg,Live Score | IND vs SA Live Score Warm Up Match T20 World Cup 2026: India  vs South Africa Full Scorecard Online - Sports News | The Financial Express
images/img_222.jpg,"Sports News - Latest Sports News, Live Scores, Results Today's Sports  Headlines Updates | Times Now"
images/img_223.jpg,"Looking at 2025, Sport: After an eventful last year, a period of lull ahead  | Explained News - The Indian Express"
images/img_224.jpg,Seifert leads New Zealand past India for T20 win despite Dube's 65 off 23 |  AP News
images/img_225.jpg,Loss to NZ in Vizag Tells us 2 Very Important Things About the Indian T20  Team |Sports Today
images/img_226.jpg,MS Dhoni's India career in doubt after losing central contract | Cricket  News | Sky Sports
images/img_227.jpg,India TV Sports Wrap on September 17: Today's top 10 trending news stories  | Other News – India TV
images/img_228.jpg,"Indian - An Indian makes history with a crazy achievement, but 95% of the  newspaper is filled with random IPL news And then we ask why we are not  good at sports"
images/img_229.jpg,"Sports News: Get Latest News on Cricket, Football, Hockey along with T20  World Cup 2024."
images/img_230.jpg,"Sports News ,Cricket News,Football updates,Latest Updates and Highlights"
images/img_231.jpg,India 58 runs from test series sweep against West Indies | AP News
images/img_232.jpg,Breaking News : Sports | ISH News
images/img_233.jpg,There have been many Sports News Media posting this before every  match[Source: SportsNow] : r/IndiaCricket
images/img_234.jpg,"Sports News: Cricket Live Scores, Latest Sports News, Football, NBA, NFL,  WWE, NHL, MLB News & More"
images/img_235.jpg,Sports News | Latest Cricket & Football News | Match Updates- The Week
images/img_236.jpg,"Sports News Today: Sports News, Latest News on Sports, Breaking News and  Trending Stories - Firstpost"
images/img_237.jpg,India stun champions Australia to reach Cricket World Cup final | RNZ News
images/img_238.jpg,"Rude shock to India's medal hopes; no cricket, hockey, badminton, shooting  in Commonwealth Games 2026. : r/indiansports"
images/img_239.jpg,ICC U19 World Cup: How the Indian press reacted to India winning fourth  title
images/img_240.jpg,"Indian wicketkeeper-batsman Rishabh Pant said that his recovery from injury  is progressing steadily and that he is hopeful of returning to competitive  cricket soon, while speaking on the sidelines of the World"
images/img_241.jpg,Indian sports industry get artificial intelligence boost from IIT Madras |  Tech News - Business Standard
images/img_242.jpg,"Sports News English | World Cup, Matches, Updates | Metro Vaartha"
images/img_243.jpg,"India Reforms Sport: Doping, Age Fraud Under Scrutiny"
images/img_244.jpg,Sports News | Sports News Headlines Today | Latest Sports News | Deccan  Chronicle
images/img_245.jpg,"Sports News, June 11 Highlights: South Africa Meet Australia In WTC Final;  India Face Argentina In FIH Pro League | Outlook India"
images/img_246.jpg,India look to extend winning run against Sri Lanka
images/img_247.jpg,"Sports News: Live Sports and Cricket News, Latest updates on Tennis,  Kabaddi, Football, Badminton, WWE & more"
images/img_248.jpg,"Search for indian-sports-news | The Tribune: Today's Latest News, Breaking  News, Top Headlines from India & World"
images/img_249.jpg,Indian Sports News
images/img_250.jpg,Sports News | England Beat India by 15 Runs in 2nd T20I to Level Mixed  Disability Series 1-1 | LatestLY
images/img_251.jpg,"Sports, Cricket News Headlines Today, September 23, 2019: South Africa won  third T20I nine wickets to level the series against India 1-1. Deepak Punia  pulled out of World Championship title to settle for silver."
images/img_252.jpg,"India vs England: Live updates, scores, teams as India win by 106 runs | Sporting  News India"
images/img_253.jpg,Indian Sports Highlights Oct 23: India lose to Germany in hockey; Tamil  Thalaivas beat Puneri Paltan - ESPN
images/img_254.jpg,"Sports News, Latest Sports Updates, Cricket World Cup, Football, Tennis,  Hockey &amp;amp;amp; IPL"
images/img_255.jpg,Can India win the World T20 cricket tournament? - BBC News
images/img_256.jpg,Hindi news | hindi newspaper |news in hindi: Sports cricket news updates  india 5 august 2011|team india sports news...
images/img_257.jpg,The quiet perfection of Ravindra Jadeja - Sports Insights News | The  Financial Express
images/img_258.jpg,"New Zealand thrash India to end losing streak - Dubai Eye 103.8 - News,  Talk & Sports"
images/img_259.jpg,Sports | DD News On Air
images/img_260.jpg,"Raw Reactions! Hugs, Tears Of Joy & Jemimah Rodrigues Trademark  Celebration, India Women's Team Celebrate Historic Win In Navi Mumbai; Video"
images/img_261.jpg,"Sports News - Latest Sports News, Breaking Sports News, Sports News  Headlines"
images/img_262.jpg,"Sports News: Live Scores, Results, Schedules of All Sports - myKhel"
images/img_263.jpg,Latest Sport News 2022 for Competitive Exam |
images/img_264.jpg,India end Pakistan's U19 World Cup campaign with commanding 58-run victory  - The Economic Times
images/img_265.jpg,"Live Scores, Latest Sports News, Results, Cricket Updates - The Hindu"
images/img_266.jpg,"Latest sports news, Today's Top sports news Headline | Awaz the voice"
images/img_267.jpg,India Technology News- Tech News and Updates | Gurugram
images/img_268.jpg,India Technology News | Latest Technology News and Updates India
images/img_269.jpg,"India's tryst with #inclusive technology, #worldclass #talent, #innovation  ecosystem & progressive policies that focuses on #tech #impact will be the  cornerstones for us to emerge as the #economic and #technological  powerhouse of"
images/img_270.jpg,Get digital access to India Technology News Magazine | Magzter.com
images/img_271.jpg,TechGig daily tech news digest - 28 October | TechGig
images/img_272.jpg,India living its tech moment; India poised for mobile market dominance |  EP-101
images/img_273.jpg,"Technology has evolved from a simple tool of convenience to becoming the  driving force behind transformation. As we head into 2025, the pace of  innovation continues to accelerate. Read more about the"
images/img_274.jpg,"National Technology Day 2024: India now a digitally empowered nation,  ETGovernment"
images/img_275.jpg,Tech News: Latest Technology News and Updates | Times Of India
images/img_276.jpg,India's Best IT Magazine: Latest Tech News & Updates
images/img_277.jpg,India Technology News (ITN)- Tech News and Updates | LinkedIn
images/img_278.jpg,"Tech News | Microsoft, Google, Intel And Cognizant Unveil Massive AI  Investments In India | 4K Video"
images/img_279.jpg,India Technology News- Tech News and Updates | Gurugram
images/img_280.jpg,India Technology News- Tech News and Updates | Gurugram
images/img_281.jpg,Newspaper Headlines: Made-In-India Hypersonic Vehicle Successfully Tested &  Other Top Stories
images/img_282.jpg,"Tech News Today Live Updates on December 25, 2024: Generative AI, data  centres to define India's tech industries in 2025 | Mint"
images/img_283.jpg,"📣 Big News for India's Tech Manufacturing! 🇮🇳 Giga Computing, a  subsidiary of the GIGABYTE Group, has partnered with Syrma SGS Technology  Limited to begin local manufacturing of GIGABYTE server motherboards in"
images/img_284.jpg,India Technology News | Latest Technology News and Updates India
images/img_285.jpg,5G Revolution: Is India ready for it? | Technology News | Latest English  News | WION
images/img_286.jpg,"Apart from user-acquisition, companies are using Indian data to train  superior closed-source AI models. | Amitabh Kant"
images/img_287.jpg,India Pushes Back Against Tech 'Colonization' by Internet Giants - The New  York Times
images/img_288.jpg,AI Unveiling Narratives - Navigating news horizons with AI on Indian  Newspaper Day
images/img_289.jpg,India has become launching pad for technology: PM Modi and more news | DD  India News Hour
images/img_290.jpg,"Infosys co-founder Nandan Nilekani's 5-point take on AI: hype, trust,  enterprise, improving lives, and India | Technology News - The Indian  Express"
images/img_291.jpg,India restores internet in Kashmir after 7 months of blackout | Science and Technology  News | Al Jazeera
images/img_292.jpg,India-US trade deal may have a $100-bn opportunity for India's electronics  exports. Here's why | Explained News - The Indian Express
images/img_293.jpg,Inside India’s start-up boom | India Now | ABC News
images/img_294.jpg,Microsoft CEO Satya Nadella said India must accelerate the adoption of new  technologies to fully benefit
images/img_295.jpg,'Trump Needs Indian Skilled Workers': Expert On Big Tech's AI Bet On India
images/img_296.jpg,India Reimagines Tech Sovereignty: Budget 2026 Eyes Predictability Over  Subsidies
images/img_297.jpg,"News With Navya | Climate Action & Sustainability | During the Rafale  fighter jet deal, India asked for GaN chip technology. France agreed to  sell the chips, but not share how to"
images/img_298.jpg,TechDay India - India's technology news network
images/img_299.jpg,Unicorns Ignite India's Market: New Tech IPOs Push Total Cap Past $140  Billion!
images/img_300.jpg,Tech News: Latest Technology News and Updates | Times Of India
images/img_301.jpg,India's Cable News Predicted a Big Modi Win. How Did They Get It So Wrong?  - The New York Times
images/img_302.jpg,"Indian tech sector growth seen higher in FY25, to cross $300 billion in  FY26, Nasscom says | Reuters"
images/img_303.jpg,Engineering India's Future with Sona College of Technology - 2025 | May  2025 | Press Release | Sona College of Technology
images/img_304.jpg,"Can India catch up with the US, Taiwan and China in the global chip race?"
images/img_305.jpg,"Microsoft global tech outage: When all systems in the world go down •  Software Freedom Law Center, India"
images/img_306.jpg,"News With Navya | Climate Action & Sustainability | During the Rafale  fighter jet deal, India asked for GaN chip technology. France agreed to  sell the chips, but not share how to"
images/img_307.jpg,"News | India on Tuesday successfully demonstrated the solid fuel ducted  ramjet (SFDR) technology from the Integrated Test Range (ITR), Chandipur  off the Odisha coast. The successful demonstration places India into an"
images/img_308.jpg,How India Can Use Technology as a Strategic Tool to Advance Its Interests |  Opinion News - News18
images/img_309.jpg,"On misuse of its AI tools, Big Tech can't pass the buck | The Indian Express"
images/img_310.jpg,"GIGABYTE Expands 'Make in India' Footprint with Local Motherboard  Manufacturing, Strengthening its Commitment to India's Tech Ecosystem"
images/img_311.jpg,"Technology News: Latest Tech News on New Mobile Phones, Laptops, Gadgets &  More"
images/img_312.jpg,Tech Hiring Is Booming in India
images/img_313.jpg,"Science and Technology News - Latest Tech News Today, Gadget News, Science  News - Telegraph India"
images/img_314.jpg,"CIO News | Enterprise IT, Enterprise Technology, Tech Industry News - ET CIO"
images/img_315.jpg,"India's digital newsroom: Navigating trust, tech and transformation"
images/img_316.jpg,India Set to Ride Next Global Economic Wave Fueled by Frontier Tech
images/img_317.jpg,"DST Secretary Abhay Karandikar reveals how 36 Indian‑origin scientists  returning from countries like the US, UK, Canada, and Finland have joined  forces with IITs, IISER Pune, TIFR, and other premier ..."
images/img_318.jpg,India may block China's Huawei over security fears: Officials | Technology  News | Al Jazeera
images/img_319.jpg,"🚨 Big news for India's tech landscape! Samsung has begun manufacturing  laptops at its Greater Noida facility! 🇮🇳💻 The plant — already producing  smartphones, feature phones, tablets, and wearables — now adds"
images/img_320.jpg,Indian Tech businesses reaffirming their
images/img_321.jpg,Intel announces new projects to strengthen its support for Digital India | Technology  News - The Indian Express
images/img_322.jpg,"Airtel and Jio bring Elon Musk's Starlink to India, Intel gets a new CEO;  Infosys founder Narayana Murthy on AI usage and other top tech news of the  week - The Times"
images/img_323.jpg,Why it's hard for India to compete with global tech companies without  strong IP | Technology News - The Indian Express
images/img_324.jpg,Facebook
images/img_325.jpg,"India's technology hiring market is entering 2026 with little sign of a  strong recovery, as weak global demand, cautious corporate spending and  rapid advances in artificial intelligence continue to reshape hiring  patterns. #"
images/img_326.jpg,"Latest News | Latest Technology, eGov, Startup, Gadget, Telecom, IT,  Smartphone, Mobile News - TechObserver.in"
images/img_327.jpg,How Technology is Transforming India's IT Landscape
images/img_328.jpg,Diving into India's deep tech landscape
images/img_329.jpg,India Pushes Back Against Tech 'Colonization' by Internet Giants - The New  York Times
images/img_330.jpg,"Technology News - Get latest Tech News along with updates and reviews on  Mobile Phones, Gadgets - ETV Bharat"
images/img_331.jpg,Top Tech Publishers in India
images/img_332.jpg,Top Tech News: Budget 2026 Boosts India Chip Sector; Oracle Plans $50B Raise
images/img_333.jpg,"India orders phone companies to install govt cyber safety app in every  phone, users will not be able to delete it : r/IndiaSpeaks"
images/img_334.jpg,"India Budget 2026: AI, Services Propel Tech-Led Growth"
images/img_335.jpg,𝑵𝑬𝑾𝑺 𝑨𝑻 𝑵𝑰𝑵𝑬: 𝑻𝑯𝑬 𝑯𝑬𝑨𝑫𝑳𝑰𝑵𝑬𝑺
images/img_336.jpg,Digital India Programme: A journey of transformation
images/img_337.jpg,India's technology competition with China | Brookings
images/img_338.jpg,"We're helping build the India technology story, brick by brick: Sumit  Sonal, Qualcomm"
images/img_339.jpg,India bans 43 apps in fresh wave of web sanctions against China | Social  Media News | Al Jazeera
images/img_340.jpg,"Technology Videos: Technology News Clips, Latest Videos on Technology -  India Today"
images/img_341.jpg,"News - Digital India | Leading the transformation in India for ease of  living and digital economy | MeitY, Government of India"
images/img_342.jpg,"India Startup News Roundup: Policy, Funding & Innovation Updates"
images/img_343.jpg,Making computer science research more accessible in India | MIT News |  Massachusetts Institute of Technology
images/img_344.jpg,"India is now world's third largest Internet user after U.S., China - The  Hindu"
images/img_345.jpg,"India news, articles and features | New Scientist"
images/img_346.jpg,Mobile was deep-tech in the 1990s': DPIIT Joint Secretary Sanjiv Singh on  India's deep-tech challenges
images/img_347.jpg,"News With Navya | Climate Action & Sustainability | During the Rafale  fighter jet deal, India asked for GaN chip technology. France agreed to  sell the chips, but not share how to"
images/img_348.jpg,India Today Group's AI anchor Sana wins global media award for AI-led  newsroom transformation - India Today
images/img_349.jpg,"Government News | Latest news on eGovernance, Digital India, Smart Cities |  ET Government"
images/img_350.jpg,News | RTX's Collins Aerospace Inaugurates India Digital Technology Center  | RTX
images/img_351.jpg,"Technology News India: Latest Tech News Today, Gadgets, Smartphone News"
images/img_352.jpg,Bad news for India's IT sector employees as new company formations decline  by 90% due to...;
images/img_353.jpg,Times of India: New initiatives by Government of India to increase women  researchers in Science and Tech. #DST #WomeninScience Read:  https://t.co/O4yTSeIx9Z
images/img_354.jpg,"Latest Business Technology News – AI, Startups, IT Industry & Cybersecurity  Updates | ET Tech"
images/img_355.jpg,India's Tech Hubs: Bengaluru vs Hyderabad - India Briefing News
images/img_356.jpg,Technology Distributors Fuelling India's Tech Landscape
images/img_357.jpg,"Tech Wrap May 29: Google store in India, Copilot for gaming, Lava Bold | Tech  News - Business Standard"
images/img_358.jpg,India is rising to the semiconductor challenge — and these skills are in  demand
images/img_359.jpg,India has seen months of extreme heat and this week it will only get hotter  | CNN
images/img_360.jpg,2023: India's Weather In 8 Charts
images/img_361.jpg,12/07/14 - Skymet Weather Report for India
images/img_362.jpg,Rainfall Predicted in Certain Parts of India | Weather News | CNBC TV18
images/img_363.jpg,weather forecast for India | Latest updated news - Page 1
images/img_364.jpg,Weather forecast today HIGHLIGHTS: Rains to lash northeast; cloudy morning  in Delhi | Weather News - The Indian Express
images/img_365.jpg,Weather today: October heat persists as rains continue in several parts of  India - Check full forecast - India News | The Financial Express
images/img_366.jpg,Check city-wise weather forecast today for North India - The Tribune
images/img_367.jpg,Weather forecast for the week in India from 6th January to 12th January |  Skymet Weather Services
images/img_368.jpg,"#DIU | Heatwave and heavy rain alerts! India’s weather shifts from June  11-14. Check the warning forecast for upcoming days., More on  BusinessToday.in"
images/img_369.jpg,Here are a few visuals of the skies and the first day of the 14-day  lockdown that kicked off in Jaipur on Monday. (📸: BCCL) #JaipurLockdown  #ClearSkies #Weather #WeatherChannel #TheWeatherChannel #WeatherNews #Sky
images/img_370.jpg,How Indians are coping with a dangerously hot summer - BBC News
images/img_371.jpg,ALL INDIA NEWS
images/img_372.jpg,India monsoon is starting | CNN
images/img_373.jpg,India weather: Temperature passes 50C Celsius in northern India | news.com.au  — Australia's leading news site for latest headlines
images/img_374.jpg,"Skymet Weather Report - India March 28, 2013"
images/img_375.jpg,31-03-2015 Skymet Weather Report for India
images/img_376.jpg,"India weather update: Rain predicted in 18 states including Delhi, Kerala  and northeast, Gujarat to witness heatwave - The Economic Times"
images/img_377.jpg,India Weather Map | IBG News
images/img_378.jpg,"Weather Forecast March 1: Rain, snow in Kashmir, Himachal to continue;  showers to reduce from East India | Skymet Weather Services"
images/img_379.jpg,Rainfall Information | India Meteorological Department
images/img_380.jpg,"IMD weather update: Heatwave to intensify in Delhi-NCR, heavy rainfall  predicted in these states | India News – India TV"
images/img_381.jpg,IMD Forecasts Widespread Rainfall Across India Till Early September  @NewsStation
images/img_382.jpg,Climate change affects weather forecast | Bhubaneswar News - The Times of  India
images/img_383.jpg,Weather Update: Incessant rains continue in Kerala; Rajasthan records  highest rainfall in June in 123 years | India News - The Indian Express
images/img_384.jpg,"Daily Weather Briefing English (23.04.2025), #imd #weatherupdate #india  #weatherforecast #weathernews #mausam #thunderstorm #heatwave #rainfall  #hot #humid #thunderstorm"
images/img_385.jpg,India weather forecast Stock Vector Images - Alamy
images/img_386.jpg,"Current satellite animation of the weather system. For details kindly  visit: , https://mausam.imd.gov.in, #WeatherUpdate #weatheralert #Monsoon ,  Ministry of Earth Sciences Government of India, All ..."
images/img_387.jpg,"India Weather News Highlights: Heavy rains lash parts of Delhi; Above  normal rainfall across the country during Sept, says IMD | India News - The  Indian Express"
images/img_388.jpg,More rain for Northeast India
images/img_389.jpg,Extreme weather in India taking a toll on people and economy | India News
images/img_390.jpg,India facing Extreme Weather
images/img_391.jpg,Weather forecast in India | Indiablooms - First Portal on Digital News  Management
images/img_392.jpg,𝙒𝙚𝙖𝙩𝙝𝙚𝙧 𝙐𝙥𝙙𝙖𝙩𝙚 𝙅&𝙆 𝙁𝙤𝙧𝙚𝙘𝙖𝙨𝙩 ○ 23rd-29th Dec : Partly  cloudy. ○ 30th Dec-1st Jan : Possibility of light Rain/light snow (higher  reaches) at few places. ○ 2nd-3rdJan : Partly cloudy. 𝘼𝘿𝙑𝙄𝙎𝙊𝙍𝙔 ⚠
images/img_393.jpg,India weather: Heatwave sends temperatures soaring to 50C - health alert  raised as death t | World | News | Express.co.uk
images/img_394.jpg,Monsoon | Rainfall | Weather Forecast | Karnataka | Temperature | National  - Oneindia News
images/img_395.jpg,"Weather Forecast Today: IMD predicts widespread rainfall across India;  Heavy showers likely in Uttar Pradesh, Himachal, Odisha and THESE states - India  News | The Financial Express"
images/img_396.jpg,Indian Weather as of 22 May 2021 | IBG News Editor Desk
images/img_397.jpg,Mumbai rains: Is India's weather becoming more extreme?
images/img_398.jpg,"India Weather Highlights: Central team to visit Assam, Meghalaya to assess  flood damage, says Amit Shah | Weather News - The Indian Express"
images/img_399.jpg,"Weather Forecast: Heavy Rain Predicted In South India, Snowfall In North -  WION Climate Tracker News"
images/img_400.jpg,"Delhi Weather: High temperature, humidity, wind and western disturbances  make it a relentless month | Delhi News - Times of India"
images/img_401.jpg,Climate migration predicted to rise in India amid extreme weather
images/img_402.jpg,"India weather report, 'heatwave woe to continue': IMD"
images/img_403.jpg,India reports first heat-related death this year
images/img_404.jpg,India heat wave continues
images/img_405.jpg,"IMD to use new forecast technique to assess impact of high rainfall better,  help save lives and property | India News - Times of India"
images/img_406.jpg,Cyclone Vayu poised to hit India as year's second major storm | Climate  Crisis News | Al Jazeera
images/img_407.jpg,😍 Pleasant weather all over the country Check now for your location:  https://t.co/pwmwDJcGV5 #india #weather #temperature #winter #weatherupdate  #weathernews
images/img_408.jpg,Mumbai Weather Today Live Updates: IMD issues red alert for heavy rain;  IndiGo and SpiceJet issue advisories as Mumbai continues to receive rains -  The Economic Times
images/img_409.jpg,Delhi Hits Record 126 F Degrees As Extreme Heat Wave Envelops North India
images/img_410.jpg,IMD has forecast heavy to very heavy rainfall in several parts of the  country New Delhi (Agency): The India Meteorological Department (IMD) has  forecast heavy to very heavy rainfall at isolated places
images/img_411.jpg,IMD predicts rainfall in northwest India for next 2 days | Check state-wise  full forecast | Today News
images/img_412.jpg,"India Weather update: Delhi to get relief from fog soon, cold wave to  worsen in some states - India News News"
images/img_413.jpg,WATCH: Latest India Weather Forecast: December 21
images/img_414.jpg,"India likely undercounts heat-related deaths, tempering its response,  officials say | PBS News"
images/img_415.jpg,"IMD Weather Alert: Forecast for January 23, 2026, Significant weather  changes are predicted across Northwest part of India. The India  Meteorological Department (IMD) has issued warnings for Heavy ..."
images/img_416.jpg,India’s heat action plans exclude the most vulnerable: Report
images/img_417.jpg,Weather report: IMD predicts rainfall and western disturbance for  northwestern India and Himalayan region - India News | The Financial Express
images/img_418.jpg,India Weather Update: Cold Wave Grips Northern India; Weather Department  Predicts Rainfall In South - WION Climate Tracker News
images/img_419.jpg,India Weather Highlights: Heavy rainfall to continue in northeast states;  thunder showers and lightning in Mumbai | Weather News - The Indian Express
images/img_420.jpg,"Present heat wave conditions very likely to continue to prevail mainly  during next 2 days over plains of northwest India, Central India &  adjoining interior parts of eastern India | IBG News"
images/img_421.jpg,All India Weather Forecast Bulletin | Download PDF
images/img_422.jpg,"Weather Update: North India witnesses dense fog, IMD predicts rainfall |  Today News"
images/img_423.jpg,Catastrophic rainfall hits parts of India
images/img_424.jpg,"IMD issues heatwave alert for parts of east, peninsular India over next two  days - India News News"
images/img_425.jpg,Delhi 'unbearable' as temperatures soar past 50C
images/img_426.jpg,All India weather watch
images/img_427.jpg,Bharat Forecast System: India launches world's most precise weather model  to improve predictions | India News - Times of India
images/img_428.jpg,"IMD Weather update: Heatwave to intensify in north, west India; rainfall  predicted in these states | India News – India TV"
images/img_429.jpg,"Weather Forecast Today: Delhi AQI continues to remain 'very poor'; IMD  predicts heavy rainfall in parts of southern India, dense fog over Himachal  - India News | The Financial Express"
images/img_430.jpg,Weather Wrap : Northwest And Central India To Experience Heatwave;  Northeast Braces For Rainfall | Outlook India
images/img_431.jpg,Delhi temperature hits highest ever in India: weather bureau
images/img_432.jpg,"Rainfall forecast for the next 3 days-Pan India, #Skymet #WeatherForecast  #Rainfall #RainAlert, Rain, rainfall weather, weather news, weather forecast"
images/img_433.jpg,All India Weather Forecast Bulletin | Download PDF
images/img_434.jpg,India braces for rains as another cyclone approaches west coast | Climate  Crisis News | Al Jazeera
images/img_435.jpg,Summer 2021 Weather Forecast Predictions: How hot will summer 2021 be?
