image_path,caption
images/img_436.jpg,"Weather Update: Heavy rain in over 10 states today, know latest weather  forecast – Firstpost"
images/img_437.jpg,"Daily Weather Briefing English (08.02.2025), #imd #weatherupdate #india  #rain #weatherforecast #weathernews #coldwave #coldday #coldwavewarning  #rainfallupdate #fog #fogweatherupdate ..."
images/img_438.jpg,"India weather news Highlights: Rajasthan hit by severe rain, IMD issues  flood alert for Tonk| India News"
images/img_439.jpg,All India Weather Warning Bulletin (1700 hours) - TOP INDIAN BUREAUCRACY  NEWS | SARKARIMIRROR
images/img_440.jpg,"India weather news: Heavy rains lash Delhi, Chandigarh, Jammu and Himachal;  check IMD's forecast for the"
images/img_441.jpg,"Weather update in NE, India and neighbourhood today"
images/img_442.jpg,"IMD forecast: India braces for stormy weather, heatwaves, early monsoon | India  News - Business Standard"
images/img_443.jpg,India Brings AI to Its Aatmanirbhar Weather Forecasting - Sify
images/img_444.jpg,"All India Weather Forecast | World News, Latest and Breaking News, Top  International News Today - Firstpost"
images/img_445.jpg,Heatwave In India Live Updates: When Will Delhi Get Relief From Heatwave?  IMD Issues Statement | Today&#039;s Weather Report | TheHealthSite.com
images/img_446.jpg,"The Morning - Weather Forecast Across Country New Delhi, Jan 6 (Agency):  The India Meteorological Department (IMD) has issued an orange colour  warning for dense to very dense fog conditions in Madhya"
images/img_447.jpg,Weather Today Highlights: IMD issues 'Red alert' for intense rainfall and  thunderstorms in several North Indian states - The HinduBusinessLine
images/img_448.jpg,"Asia Weather News: India heat growing, Tokyo rain clearing but both Japan &  Korea hotter than normal | WeatherWatch - New Zealand's Weather Data &  Alerts Authority"
images/img_449.jpg,Indian Education News (@IndianEducationNews) • Facebook
images/img_450.jpg,India Education Round-Up | April 2024 | Central Government plans to  integrate 46 lakh class 10 and 12 dropouts back into mainstream education |  QS I-GAUGE
images/img_451.jpg,Why India's poorest children are falling further behind
images/img_452.jpg,NEP2020 is being applauded throughout the world. People are able to see how  India is moving in the right direction to strengthen its education  ecosystem. - Hon'ble PM Shri @narendramodi #OurTeachersOurPride  @HindustanTimes
images/img_453.jpg,I write for the Times of India on empowerment through education. Do read.
images/img_454.jpg,"Impasse caused by pandemic offers room to rethink board exams, find  alternatives | The Indian Express"
images/img_455.jpg,Indian teachers help pandemic-hit girl dropouts return to school | Education  News | Al Jazeera
images/img_456.jpg,Top emerging school by Times of India for the year 2023 - Best Cambridge  School in Hyderabad - The Indian Public School
images/img_457.jpg,Cabinet Clears New National Education Policy; Other Big Stories
images/img_458.jpg,India | International Education News
images/img_459.jpg,Millions of students at risk: India's elite exams hit by corruption 'scam'  | Education News | Al Jazeera
images/img_460.jpg,Why Are 7.6 Lakh Indian Students Leaving India in 2024? | Top 5 Education  News.
images/img_461.jpg,"To Innovate, India Needs to Reform Its Education System"
images/img_462.jpg,"Here's yet another unfortunate example of how the education system is being  systematically ruined by the BJP and its allies. ☝️ 👉 It has been nine  days since schools reopened in Maharashtra,"
images/img_463.jpg,Hundreds march in India to demand 'affordable education for all' | Education  News | Al Jazeera
images/img_464.jpg,India - New Education Policy 2020. An article by the Vice President of India...  | Facebook
images/img_465.jpg,"School enrolment across India fell by 1.11 million students in 2024-25,  with the steepest decline concentrated in the early years of education,  according to the latest government data. Read 🔗  https://www.hindustantimes.com/india-news/every-indian ..."
images/img_466.jpg,Education | Turning a new page - India Today
images/img_467.jpg,"Tamil Nadu To Release State Education Policy; Countering NEP, 3-Language  System | India Today News"
images/img_468.jpg,"Contributed an article on Higher Education in India. It was published by  the Times of India @TOIIndiaNews October 20, 2018 on its Editorial page."
images/img_469.jpg,MEDIA COVERAGE | Presidium Gurgaon
images/img_470.jpg,India's New Education Policy Misses Fundamental Flaws
images/img_471.jpg,"Indian Education Major Developments on February 1, 2025 Latest News  Lurnable.com"
images/img_472.jpg,Developing world: Educating India | Nature
images/img_473.jpg,India's $94 bn spend on basic education doesn't address teaching crisis
images/img_474.jpg,"INDIA #education #UNESCO A pressing concern is the completion rate at the  upper secondary level. In the gender equality index, India's progress in  education has been mixed with significant disparities remaining in"
images/img_475.jpg,What Indian Higher Education Needs to Do
images/img_476.jpg,"📢 EDUCATION NEWS – NITI AAYOG REPORT 🇮🇳📚 NITI Aayog has highlighted a  major trend in India's education landscape: for every 1 international  student coming to India, nearly 19 Indian students go"
images/img_477.jpg,Denying Children Education is Simply Wrong - Fair Observer
images/img_478.jpg,"The Rigth Time to Transform- ""indian character of Higher Education"" |  cambridge Group of Institutions"
images/img_479.jpg,Stay updated with the latest happenings in education! Read the full story  on Edinbox – your source for authentic education news. #EducationNews  #EdinboxUpdates #AcademicInsight #edInbox
images/img_480.jpg,India's Education System Needs Urgent Reform
images/img_481.jpg,"Current News Videos: Globalizing Indian Education: Pathways, Challenges,  and Opportunities"
images/img_482.jpg,"Indian Education System is gearing up to become the best in the world. With  a transformational NEP 2020 at its core, implementation of key mandates  will ensure an accelerated journey. Eupheus… |"
images/img_483.jpg,Infographic: Why India shouldn't celebrate a rise in education enrollment  ratio | India News - Times of India
images/img_484.jpg,"Professors turned to Delivery Workers - A GRIM TALE OF INDIA'S Outdated  Education System: In a shocking reflection of the state of Indian education,  a recent news article highlighted how a massive… |"
images/img_485.jpg,CM @ArvindKejriwal writes on Delhi education model being the way forward  for country's development in today's Times of India :
images/img_486.jpg,Education News | Education Sector News | Education News India
images/img_487.jpg,This is what 'Education Success' looks like in India - From full-page  classified section in today's newspaper : r/india
images/img_488.jpg,Is Our System Strong Enough To Implement New Education Policy? | News Today  With Rajdeep Sardesai
images/img_489.jpg,Indian Education Reform News
images/img_490.jpg,India TV Speed News Education Conclave Highlights: What will be the future  of Indian education? Know what experts said | Education News – India TV
images/img_491.jpg,Teachers who don't show up to work cost India $1.5 billion a year
images/img_492.jpg,Macaulay's Legacy: Special Report on the Debate Over English Education in  India
images/img_493.jpg,India probe after exam leak hits 1.6 million students
images/img_494.jpg,Finland's big new export to India: Education | Business and Economy News |  Al Jazeera
images/img_495.jpg,COVID-19's impact on education in India: It's not all bad news | Global  Sisters Report
images/img_496.jpg,LEAD School Co-Founder and CEO Sumeet Mehta's article on the necessity of  changing outdated pedagogy to complement changes in curriculum - was  published in the Hindustan Times today!
images/img_497.jpg,Making computer science research more accessible in India | MIT News |  Massachusetts Institute of Technology
images/img_498.jpg,Britannica Education Revolutionizes Learning in India with 12 Digital Tools
images/img_499.jpg,History wars' erupt in India over 'Hinduisation' of education system - ABC  News
images/img_500.jpg,"Transforming Education: Insights from India's Schools in 2025, ETEducation"
images/img_501.jpg,Beyond Access to Education: Let's Talk Quality – Institute for  Competitiveness
images/img_502.jpg,"Except in 2 states, school scores dip below levels from 5 yrs ago: Survey | Education  News - The Indian Express"
images/img_503.jpg,Harpur Fellow travels to India for healthcare project - Binghamton News
images/img_504.jpg,"The truth about Indian education – challenges, loopholes, and solutions"
images/img_505.jpg,10 Big Questions About International Education for Indian Students in 2025
images/img_506.jpg,India's Education Sector Fails Industry Demands: 75% Institutions Lag
images/img_507.jpg,Welcoming Swaminathan Aiyar sir's article on India education | Maan Patel  posted on the topic | LinkedIn
images/img_508.jpg,60% rural private school students in class 5 cannot solve a simple division  problem: Report | Education News - The Indian Express
images/img_509.jpg,Education | Turning a new page - India Today
images/img_510.jpg,"The news of the future of over 700 Indian students at Harvard hanging in  balance has gotten parents worried. What next? How do we prep our kids for  higher education? If they are from an IB curriculum, ..."
images/img_511.jpg,India’s education facilities feel the strain
images/img_512.jpg,School enrolment drops for third year in a row; 'falling birth rates' cited  | Education News - The Indian Express : r/india
images/img_513.jpg,Bridging the digital divide in India's education landscape demands a  multi-faceted approach - India Today
images/img_514.jpg,Exclusive Education News & Stories | ET Education
images/img_515.jpg,"India's education sector is set for strong income growth, driven by  reforms, digital learning, and rising demand. 🔗 https://dvmg.us/Rnv7W69  @GlobalIndianNewsNetwork #EducationNews #IndianEconomy #EdTech  #FutureOfEducation #GrowthStory ..."
images/img_516.jpg,Indian American high school students return after successful teaching  program in India under AIM For Seva - indica News
images/img_517.jpg,"H1B News Today | Union Education Minister: Only A Fraction Go Abroad, India  Has 4.5 Crore Students"
images/img_518.jpg,"Express Investigation — Part 4 | After 5 weeks of catch-up, some progress,  some problems unsolved | Education News - The Indian Express"
images/img_519.jpg,Education News | Education Sector News | Education News India
images/img_520.jpg,"IITHyderabad's outreach initiative empowers government school students by  offering first-hand exposure to higher education, cutting-edge research  facilities, and interdisciplinary learning environments. #IITHyderabad  #InTheNews #CampusImpact ..."
images/img_521.jpg,Private Equity's Big Bet on Indian Education? K-12 Techno Eyes $200M  Funding Boom!
images/img_522.jpg,"School education takes biggest hit: Govt cuts proposed education spending  by Rs 6,000 cr | India News - The Indian Express"
images/img_523.jpg,"Headlines can be self-centred. But when adolescents read them together,  they become community-centred. 📰✨ Through the JSW Aspire Adolescent  Education Programme, Magic Bus India Foundation, under its Bal Sabha  initiative, empowered Bal"
images/img_524.jpg,"Education News Updates Nov 18, 2024: CSEET results, Haryana schools shut -  The Hindu"
images/img_525.jpg,nep: Making India an education hub: How NEP is helping open new roads to  higher studies - The Economic Times
images/img_526.jpg,Can India's education budget fund increased spending in new policy? |  Economy & Policy News - Business Standard
images/img_527.jpg,"Re imagining and reshaping education for life: Living Room Conclave, India  Education Mission | Education News"
images/img_528.jpg,India outperforms China with five times more schools: Niti Aayog Report -  India Today
images/img_529.jpg,"PDF) Is Education News: A Study on the Representation of Education News in  the 'Times of India' newspaper, Mumbai edition, 2008-2009"
images/img_530.jpg,BBC News - The rot in India's primary education
images/img_531.jpg,Indian students expelled for mass cheating in exams
images/img_532.jpg,Bihar's library classrooms are teaching kids to spot fake news. Should  others follow? - India Today
images/img_533.jpg,Progress of Indian education sector after Independence — The Indian Panorama
images/img_534.jpg,Education News | Education Sector News | Education News India
images/img_535.jpg,Addressing accessibility & the digital divide in education
images/img_536.jpg,News | ARii
images/img_537.jpg,NEWS — General Pathology
images/img_538.jpg,"India healthcare deals surge past Rs 10,000 crore in Q2 FY26: EY-Parthenon  report"
images/img_539.jpg,Can tech help revive India's 'crumbling' health system?
images/img_540.jpg,"India healthcare News - The Latest News, Insight, Commentary & Analysis at  Healthcare Asia Magazine"
images/img_541.jpg,How to help India amid COVID-19 surge that's devastating the country - ABC  News
images/img_542.jpg,"Healthcare in India has made great progress, but challenges remain — The  Indian Panorama"
images/img_543.jpg,Beyond Beds and Medicines: Unraveling the Healthcare Crisis in India
images/img_544.jpg,"Indian doctors fighting COVID ‘overworked, stressed, frightened’"
images/img_545.jpg,India unveils 'world's largest' public healthcare scheme
images/img_546.jpg,"Indian Healthcare | American Woman Blown Away By India’s Healthcare System,  Says ‘It’s Incredible'"
images/img_547.jpg,Why India's health system is on the 'brink of collapsing'
images/img_548.jpg,"The Lancet Critiques Indian Healthcare, Questions Lack Of Data Transparency  In Sector | Latest News"
images/img_549.jpg,India's female health workers on rural front line get COVID shot |  Coronavirus pandemic News | Al Jazeera
images/img_550.jpg,What Ails India's Health Care?
images/img_551.jpg,What's the future for health care in India? — Harvard Gazette
images/img_552.jpg,"India's healthcare sector is at a crucial crossroads. Despite being a  global drug supplier, the nation still depends heavily on imported medical  devices- a gap that calls for bold, original innovation. As"
images/img_553.jpg,India hits another grim virus record as oxygen demand jumps | PBS News
images/img_554.jpg,India healthcare: Will the 'world's largest' public scheme work?
images/img_555.jpg,"A silent health revolution is unfolding in India. And it's written in our  genes. From ancestry to disease prevention, genetic testing is changing how  we see our bodies. Swipe to understand why. >> #"
images/img_556.jpg,You Can't Treat Who You Can't Reach” We talk about India's healthcare  progress in terms of new hospitals and upgraded tech. But what good is a  clinic… if no one walks in?
images/img_557.jpg,"World News in Brief: Self-sufficiency call for healthcare funding,  Australia treaty with Indigenous Peoples, Haiti women at risk | UN News"
images/img_558.jpg,India Budget 2024: Experts advocate boosting healthcare allocation to 2.5%  of GDP | WION News
images/img_559.jpg,India COVID crisis: Tragic scenes at a hospital in Uttar Pradesh |  Coronavirus pandemic News | Al Jazeera
images/img_560.jpg,India's healthcare: does Modi have the right cure?
images/img_561.jpg,BIGGEST RED FLAG FOR DOCTORS India isn't facing a “shortage of doctors.”  India is facing a shortage of doctors who haven't been broken by the system  yet. 9–12 years of training. 36–50
images/img_562.jpg,"India Healthcare: Healthcare outcomes in India: There's a spark of  substantial progress, but it's a long road ahead - The Economic Times"
images/img_563.jpg,Health Insurance Paradox in India Rising Premiums Shrinking Care - Watchdoq  Newsportal
images/img_564.jpg,India healthcare: Will the 'world's largest' public scheme work?
images/img_565.jpg,"In India, healthcare cost is 50% of that in developed nations' | Nagpur News  - The Times of India"
images/img_566.jpg,"Healthcare in India: rarely an election issue, despite limited access |  Explained News - The Indian Express"
images/img_567.jpg,State of play of India's healthcare sector exposed by COVID-19 | Reuters
images/img_568.jpg,Harpur Fellow travels to India for healthcare project - Binghamton News
images/img_569.jpg,India's Healthcare Ecosystem: Sector Highlights for Investors
images/img_570.jpg,India Latest News Today | India's First Indigenous Antibiotic: A  Game-changer | Healthcare | News18
images/img_571.jpg,"A silent health revolution is unfolding in India. And it's written in our  genes. From ancestry to disease prevention, genetic testing is changing how  we see our bodies. Swipe to understand why. >> #"
images/img_572.jpg,Can AI address India's healthcare challenges? A recent article talks about  how Al is reshaping patient care. Generative AI could fundamentally change  how the country addresses capacity constraints… | nasscom | 17 comments
images/img_573.jpg,US to send support as India battles devastating COVID surge | Coronavirus  pandemic News | Al Jazeera
images/img_574.jpg,"India has few coronavirus cases, but the country is unprepared for a spike,  experts warn - ABC News"
images/img_575.jpg,"Healthcare crisis: Short of 5 lakh doctors, India has just 1 for 1,674  people | India News"
images/img_576.jpg,"In India, healthcare is not commerce, rather a service, says Mandaviya |  Ahmedabad News - The Indian Express"
images/img_577.jpg,📰 In the News | The Times of India Timely detection of cervical cancer can  save lives — yet many women are still diagnosed too late. In an expert  column published in
images/img_578.jpg,Budget 2026 positions India to accelerate from volume-driven production to  value-driven global leadership in Healthcare: Experts
images/img_579.jpg,India's Pharma Revolution: How Bharat Became the World's Medicine Hub | 80%  Cheaper Drugs | N18G
images/img_580.jpg,Health is (Literally) Wealth in India
images/img_581.jpg,"Interview with Abhay Soi, Max Healthcare's leader and India's most valuable  healthcare company. | Rica Bhattacharyya posted on the topic | LinkedIn"
images/img_582.jpg,"Indian American physicians proudly participating in the Indian Medical  Association convention, strengthening global healthcare ties through  knowledge, collaboration, and service. 🇮🇳🇺🇸🩺 LINK IN BIO  #IndianMedicalAssociation #IndianAmericanDoctors ..."
images/img_583.jpg,Coronavirus: How India descended into Covid-19 chaos
images/img_584.jpg,How Startups Are Trying To Overcome India's Healthcare Challenges
images/img_585.jpg,Reset and reform | The Indian Express
images/img_586.jpg,"Healthcare news india - Latest healthcare news india , Information &  Updates - Health -ET HealthWorld"
images/img_587.jpg,Watch Bernstein India Healthcare Analyst on Worsening Covid-19 Situation in  India - Bloomberg
images/img_588.jpg,India sees worst single-day rise in COVID cases since December 24 |  Coronavirus pandemic News | Al Jazeera
images/img_589.jpg,"Healthcare: Focus on preventive care, plus accessible, affordable screening  | Delhi News - The Indian Express"
images/img_590.jpg,India's healthcare system needs to focus on children's health | Prashant  Menon posted on the topic | LinkedIn
images/img_591.jpg,What do you guys think about nhs getting 2k docs from India to plug in  shortages : r/medicalschooluk
images/img_592.jpg,"When healthcare conversations move beyond treatment to long-term impact.  Proud to have Dr. Smeet Patel, Director, Mayflower Women's Hospital and  EL&EL Industries, quoted in Ahmedabad Mirror on the evolving healthcare  strategy shaping"
images/img_593.jpg,India's public health system on the verge of collapse
images/img_594.jpg,India's new health push needs deeper inclusion | India News - Times of India
images/img_595.jpg,"This editorial is based on “When government cares, healthcare makes  strides” which was published in The Hindu on 07/07/2025. Read More:  https://www.drishtiias.com/daily-updates/daily-news-editorials/transforming- india-s-healthcare-system #Editorial ..."
images/img_596.jpg,India healthcare: Will the 'world's largest' public scheme work?
images/img_597.jpg,"India Urged to Build Citizen-Centred, Tech-Driven Healthcare System  Lancet-commissioned experts are calling for a bold shift toward a  citizen-centred healthcare system in India, where publicly funded services  form the backbone of Universal"
images/img_598.jpg,Telemedicine in India: Tech-Driven Democratization of Healthcare
images/img_599.jpg,India Budget 2026 Elevates Healthcare To Growth Sector | WION News
images/img_600.jpg,Why India is poised to become a world leader in healthcare innovation - IMD  business school for management and leadership courses
images/img_601.jpg,Indians have only themselves to blame for the health disaster | Health | Al  Jazeera
images/img_602.jpg,India to Roll Out Digital Health IDs for Over 1.3 Billion People - Bloomberg
images/img_603.jpg,Second wave of Covid-19 to take a toll on Indian healthcare system: Fitch |  Coronavirus Latest News - Business Standard
images/img_604.jpg,"Times Network India Health Summit 2025: Experts Urge Responsible AI Use as  Tool, Not Replacement for Clinicians | Health - Times Now"
images/img_605.jpg,"Uttar Pradesh is poised to emerge as India's largest healthcare and medical  technology hub, serving not only its 25 crore population but also the  healthcare needs of people across the country and"
images/img_606.jpg,"Health Budget 2026 Experts Reaction: Big Signals For Healthcare, What  Leaders See - CAAS INDIA NEWS"
images/img_607.jpg,India Healthcare Sector Explained: 3 Stocks to Watch in 2025–26
images/img_608.jpg,Healthcare Budget 2026 Sets Direction For Affordable Care And Capacity  Building - CAAS INDIA NEWS
images/img_609.jpg,"India Healthcare Deals Top ₹10,000 Crore Amid Sector Strength"
images/img_610.jpg,"Balancing Access, Innovation, and Affordability in Indian Health Care :  Daily News Analysis"
images/img_611.jpg,Cadila jumps nearly 8% after COVID-19 vaccine gets India emergency use nod  | Reuters
images/img_612.jpg,Healthcare News | Health Industry News | Health Sector News
images/img_613.jpg,"American vlogger amazed by Indian healthcare, says 'it's incredible' -  World News"
images/img_614.jpg,Coronavirus crisis: COVID-19 exposes healthcare spending – Why a post  coronavirus India needs to ramp up its health investment | Business News
images/img_615.jpg,A chance to rejuvenate India's healthcare sector | The Indian Express
images/img_616.jpg,"India Beyond The Pandemic: A Sustainable Path Towards Global Quality  Healthcare: Chalil, Dr. Joseph M, Kapur, Pradeep Kumar, Nalapat, Madhav  Das, Kant, Amitabh, Puri, Hardeep Singh: 9781735904863: Amazon.com: Books"
images/img_617.jpg,"American woman shares 'crazy' hospital experience in India, compares to US  | Health News - Business Standard"
images/img_618.jpg,India could have 1 billion digital healthcare users by 2030 - Express  Healthcare
images/img_619.jpg,India@75: India's achievements in healthcare sector since independence -  Edge News
images/img_620.jpg,"Indian doctors face censorship, attacks as they fight coronavirus |  Coronavirus pandemic News | Al Jazeera"
images/img_621.jpg,"In India, healthcare is not commerce, rather a service: Minister Dr  @MansukhMandviya"
images/img_622.jpg,India records deadliest day of pandemic as more international aid arrives |  SBS News
images/img_623.jpg,How India Can Strengthen India's Healthcare Workforce To Meet Future Health  Needs
images/img_624.jpg,India Health exhibition elevates healthcare innovation and collaboration to  new heights - Express Healthcare
images/img_625.jpg,"NRI couple returns after 17 years from US, calls India's THIS system  'affordable and accessible' - Trending News | The Financial Express"
images/img_626.jpg,"More than 280 killed, about 900 hurt after 2 trains derail in India | PBS  News"
images/img_627.jpg,India train disaster: What we know so far | News | Al Jazeera
images/img_628.jpg,Siemens Mobility Awarded €3bn Indian Railways Locomotive Order | Railway- News
images/img_629.jpg,Kanchenjungha Express: Nine killed in India train collision
images/img_630.jpg,Deadly Train Derailments in India
images/img_631.jpg,Cause of Indian train crash that killed hundreds remains unknown as  officials say rescue efforts completed
images/img_632.jpg,Up to 15 reported killed in Indian train collision | Transport News | Al  Jazeera
images/img_633.jpg,Train disaster renews safety questions as India's government pushes rail  upgrade | PBS News
images/img_634.jpg,"India Funds New Trains Ahead of Safety Improvements, Analysts Say - The New  York Times"
images/img_635.jpg,"Signaling system error led to deadly India train crash, railway official  says | PBS News"
images/img_636.jpg,"India Train Crash: More Than 200 Dead, 900 Injured"
images/img_637.jpg,16 firms show interest in running private trains
images/img_638.jpg,"India train disaster: Signal error most likely caused accident, official  says"
images/img_639.jpg,Indian Railways all set to procure 50 New Push-Pull Amrit Bharat Express  Trains | Urban Transport News
images/img_640.jpg,Probe into India rail disaster begins as train services resume
images/img_641.jpg,Indian Railways Plans Record Investment in High-Speed Rail | Railway-News
images/img_642.jpg,"Passenger train derails in India, killing at least 2 passengers and  injuring 20 others | AP News"
images/img_643.jpg,"Indian Railways Set for Major Expansion with 1,000 New Trains, Bullet Train  by 2027. Railway Minister Ashwini Vaishnaw has unveiled ambitious plans for Indian  Railways, including the launch of 1,000 new trains"
images/img_644.jpg,India Railways Launches 89 New Trains to Help Passengers Amid Flight  Disruptions
