image_path,caption
images/img_645.jpg,Indian Railways to Invest in Lidar | In the Scan
images/img_646.jpg,General Electric in $2.6bn Indian railway deal - BBC News
images/img_647.jpg,India’s Modi visits deadly train derailment crash site
images/img_648.jpg,"Crowded trains, unequal access: The state of Indian railways| Vande Bharat"
images/img_649.jpg,"railways news: Indian Railways gets 2,000 infra projects at Rs 41,000 crore  - The Economic Times"
images/img_650.jpg,Seven elephants killed in India train accident | Reuters
images/img_651.jpg,India: Mobs burn train coaches in protests over jobs in railways |  Unemployment News | Al Jazeera
images/img_652.jpg,Indian Railways plans to fence all train tracks - Xinhua | English.news.cn
images/img_653.jpg,"Indian Railways - latest news, breaking stories and comment - The  Independent"
images/img_654.jpg,"My India, September 27"
images/img_655.jpg,Alstom Delivers 100th Electric Locomotive to Indian Railways | Railway-News
images/img_656.jpg,Is Railways making money at the risk of passengers? | India News
images/img_657.jpg,Indian Railways to invest ₹7 Trillion to upgrade Track Infrastructure in  next 10 years | Urban Transport News
images/img_658.jpg,Indian Railways to Implement Boom Barriers for Crowd Management in 39  Stations
images/img_659.jpg,How India's behemoth railways are joining the fight against Covid-19
images/img_660.jpg,"The Indian Railways 100-day plan! Bogged down with criticism, the  government's 100-day railway plan includes some aggressive passenger  centric measures, including 24-hour refunds, a live mega app and focus on  passenger services."
images/img_661.jpg,Indian Railway News: Indian Railway Data Leak: 30 million Railway  customers' data for sale on the dark web - The Economic Times
images/img_662.jpg,Train 'travels 40 miles without driver'
images/img_663.jpg,"Indian Railways - latest news, breaking stories and comment - The  Independent"
images/img_664.jpg,"Railways readies movement plan, some states push for special trains | India  News - The Indian Express"
images/img_665.jpg,scrailwayindia | Railways: Sitharaman allocates Rs 2.77 lakh crore 🗞️News  Published in Telangana Today Newspaper | Instagram
images/img_666.jpg,Indian Railways To Deploy ITMS System Across All Railway Zones - Metro Rail  News
images/img_667.jpg,"Indian Railways - latest news, breaking stories and comment - The  Independent"
images/img_668.jpg,Indian Railways asks zones to plan phase-wise restoration of services |  coronavirus outbreak News - The Indian Express
images/img_669.jpg,India's deadly train crash renews questions over safety as government  pushes railway upgrade | AP News
images/img_670.jpg,"Breaking: Indian Railways Promises Action Against Vandals, CCTV Footage  Scanned To Identify Culprits"
images/img_671.jpg,"Indian Railways 'on high alert', collaborates with NIA, police to stop rail  track sabotage attempts - India News News"
images/img_672.jpg,"Kolkata(India. 24th Oct, 2018. People trade along a railway track in  Kolkata, India on Oct. 24, 2018. The state-owned Indian Railways is  planning to put fencing along all train tracks across the"
images/img_673.jpg,Blood on the tracks of India's railways - Asia Times
images/img_674.jpg,"Indian Railways has significantly upgraded its tracks over the last 11  years, boosting speed potential, with 79% of the network now supporting 110  kmph & above, up from 40% in March 2014."
images/img_675.jpg,Indian Railways selects 200 km/h upgrade option | News | Railway Gazette  International
images/img_676.jpg,Indian Railways data reveals no improvement in freight trains' speed;  marginal rise in passenger trains' speed - Railways News | The Financial  Express
images/img_677.jpg,"Good news for Vaishno Devi pilgrims, Indian Railways set to resume multiple  express trains from THIS"
images/img_678.jpg,Indian Railways Plan To Double Originating Train Capacity In 48 Major  Cities By 2030: Ministry 👉Indian Railways Will Also Develop Stations  Around Major Terminals To Distribute Train Traffic And Reduce Pressure On
images/img_679.jpg,Indian Railway News (@IndianRailwayNews) • Facebook
images/img_680.jpg,Indian Railways to start 80 new special trains from today: Here's the full  list | India News
images/img_681.jpg,"Good news for travellers: Railways to run 7,000 special trains for Chhath  Puja, Diwali festival | Today News"
images/img_682.jpg,Indian Railways invites bids to run private passenger trains | News |  Railway Gazette International
images/img_683.jpg,"Indian railway workers replacement a track in Kolkata, India on June 15,  2021.Discount on Indian Railways Train Tickets: For those who travel  frequently on Indian Railways, here is some good news for"
images/img_684.jpg,"IRCTC Latest News: Indian Railways Plans To Launch 3,000 New Trains, Will  Accommodate 1,000 Crore Passengers"
images/img_685.jpg,India's worst train crash in decades kills at least 288 | Reuters
images/img_686.jpg,"Indian Railways' Mission Raftaar gathers steam, New Delhi-Mumbai and New  Delhi-Howrah routes set for speed enhancement - Railways News | The  Financial Express"
images/img_687.jpg,Indian Railways News: Indian Railways may no longer be the lord of the rail  in India - The Economic Times
images/img_688.jpg,Indian Railways Renegotiates Vande Bharat Contract for 80 High-Capacity  Trainsets with Kinet | Machine Maker - Latest Manufacturing News | Indian  Manufacturing News - Latest Manufacturing News | Indian Manufacturing News  - Machine Maker
images/img_689.jpg,"Indian Railways partners with RKFL, TWL to reduce reliance on China | India  News - Business Standard"
images/img_690.jpg,"Indian Railways – SGTTimes.com – SGT Latest News, India News, Breaking News,  Today's News"
images/img_691.jpg,Indian Railways becomes world's largest electrified network
images/img_692.jpg,"India train tragedy: Crash kills over 280, injures 900 in one of nation's  worst rail disasters - NZ Herald"
images/img_693.jpg,Railways Plans To Resume Normal Services Of Passenger Trains In Phased  Manner This Month: Report
images/img_694.jpg,New Delhi Railway Station Stampede: ₹10 lakh compensation announced for  families of deceased by Indian Railways | Today News
images/img_695.jpg,"Railway News: Delhi-Mumbai, Delhi-Howrah route to get upgraded with new  high-speed trains, not Vande Bharat, Rajdhani, check details"
images/img_696.jpg,Infra Upgrade Allows Central Railway to Run 42 Trains at 130 kmph Across  Sections | India News - News18
images/img_697.jpg,CAG report warned Indian Railways was ignoring safety | India News - Times  of India
images/img_698.jpg,🚆 Big Safety Upgrade for Indian Railways 🇮🇳 Great news for passengers! Indian  Railways has commissioned 472.3 route km of Kavach 4.0 in a single day (30  Jan 2026) — its highest-ever
images/img_699.jpg,"For the first time, Railways allows empty passenger trains to run on  Dedicated Freight Corridor – Here's why | India News - The Indian Express"
images/img_700.jpg,"Railway News: रेलवे ने 33 ट्रेनों का बदला रूट, 345 ट्रेनें आज रद्द, देखें  पूरी लिस्ट - indian railways trains cancellation list routes diverted today  13 feb check Train list enquiry indianrail"
images/img_701.jpg,"India Train Derailment Kills More Than 100 Near Kanpur, Uttar Pradesh"
images/img_702.jpg,Indian Railways: Achievements and Future Plans - Pragativadi I Latest  Odisha News in English I Breaking News
images/img_703.jpg,Indian Railways attain 100 per cent punctuality for the first time ever
images/img_704.jpg,Indian Railways Cancel 39 lakh Tickets
images/img_705.jpg,Indian Railways suspends all train services to Bangladesh indefinitely amid  violent protests - Railways News | The Financial Express
images/img_706.jpg,"Train anti-collision tech Kavach deployed only on 1,445 km of India's rail  tracks"
images/img_707.jpg,Indian rail freight peak-season levy set to come back from next month -  Container News
images/img_708.jpg,A Journey Through Time And Ages: The Whistling Indian Rail - Metro Rail News
images/img_709.jpg,"Two killed, 20 injured in India train derailment - Mehr News Agency"
images/img_710.jpg,COVID 19 : Indian Railways Cancels All Passenger Trains Till March 31
images/img_711.jpg,Indian Government Approves India-Bangladesh Rail Link | News | South Asia  Subregional Economic Cooperation
images/img_712.jpg,Indian Railways starts installation of CCTV cameras in premium trains but  data suggests implementation remains a challenge – Firstpost
images/img_713.jpg,Zonal rivalries' derail Indian Railways bid to improve punctuality of  trains | India News
images/img_714.jpg,"Lockdown: 15 special trains to run from May 12, tweets Piyush Goyal"
images/img_715.jpg,social media on Indian Railways fare hike | Railway News on Train Fares |  Travel Updates for Public Transport users in India | | Cost of Travel after  Rationalisation in December 26
images/img_716.jpg,"Today's Paper, Latest News, Top Headlines Today, Current News Update |  Business Standard"
images/img_717.jpg,Top 10 Business Newspapers in India: A Comprehensive Guide | Ginger Media  Group
images/img_718.jpg,Top 10 Business Newspapers in India: A Comprehensive Guide | Ginger Media  Group
images/img_719.jpg,LIVE: Tracking Latest Stock Market Headlines & Top Developments | India  Business Hour | Top News
images/img_720.jpg,Top 15 Business Newspapers in India
images/img_721.jpg,"The Economic Times: Business News, Personal Finance, Financial News, India  Stock Market Investing, Economy News, SENSEX, NIFTY, NSE, BSE Live, IPO News"
images/img_722.jpg,"Business News, Finance News, India News, Stock Markets BSE/NSE News,  SENSEX, NIFTY, Personal Finance News | Business Standard"
images/img_723.jpg,India Business News | Podcast on Spotify
images/img_724.jpg,"Financial Chronicle | Financial Chronicle | Latest Indian Business News,  Live Indian Stock Market Updates | Mydigitalfc.com"
images/img_725.jpg,India has earned its place on the high table. Read my detailed interview  with The Financial Express on the #IndiaEUTradeDeal 🗞️  https://www.financialexpress.com/business/news/india-now-negotiates-from-a-position-of-strength-looks-at-every-item-on  ...
images/img_726.jpg,"The Economic Times: Business News, Personal Finance, Financial News, India  Stock Market Investing, Economy News, SENSEX, NIFTY, NSE, BSE Live, IPO News"
images/img_727.jpg,"Business News, Finance News, India News, Stock Markets BSE/NSE News,  SENSEX, NIFTY, Personal Finance News | Business Standard"
images/img_728.jpg,"Get digital access to Business Standard - January 17, 2025 issue |  Magzter.com"
images/img_729.jpg,"'18% Tariff A Strong Win For India' | Vallabh Bhansali On Tariffs, Markets  & FIIs | Modi-Trump Deal"
images/img_730.jpg,4 September 2025 : Important Financial News in India
images/img_731.jpg,"The Economic Times: Business News, Personal Finance, Financial News, India  Stock Market Investing, Economy News, SENSEX, NIFTY, NSE, BSE Live, IPO News"
images/img_732.jpg,Top 10 Business Newspapers In India: A Comprehensive Guide
images/img_733.jpg,Top 10 Business News Websites In India - Business Connect Magazine
images/img_734.jpg,"Business News, Finance News, India News, Stock Markets BSE/NSE News,  SENSEX, NIFTY, Personal Finance News | Business Standard"
images/img_735.jpg,Financial Times hits back in new trademark clash with Times of India |  Media | The Guardian
images/img_736.jpg,"BREAKING 🚨 A surprising development in the world of artificial  intelligence is catching global attention. Researchers and tech communities  are reporting that some AI bots have started forming their own digital  environments,"
images/img_737.jpg,22 September 2025 : Important Financial News in India
images/img_738.jpg,Economic Times: The Economic Times website is the only leader in business  news. Period - The Economic Times
images/img_739.jpg,US-India Trade Talks Hit Pause: Why Washington Says India Missed the First  Window | Business News
images/img_740.jpg,Is it getting any easier to do business in India? - BBC News
images/img_741.jpg,"India's trusted business voice⚡️🇮🇳 On Mint, read Business journalism that  goes beyond headlines to uncover meaning and insight🔥👀 Read the latest business  news here- #LinkInBio 🔗"
images/img_742.jpg,What is the most trustworthy Indian business newspaper?
images/img_743.jpg,Apple opening its first retail stores in India
images/img_744.jpg,Moneycontrol becomes India's no. 1 financial news destination
images/img_745.jpg,"Small Business News/ Opinion, Small Business in India Trends, Tips, Updates  | Zee Business"
images/img_746.jpg,How have Indian Businesses been impacted during and after the lockdown? –  Institute for Competitiveness
images/img_747.jpg,"All enterprises, MNCs & India Inc., big, medium & small enterprises, are  facing a reset exercise in doing business. We will have to make sure that  policies are right to make India"
images/img_748.jpg,"Business News, Finance News, India News, Stock Markets BSE/NSE News,  SENSEX, NIFTY, Personal Finance News | Business Standard"
images/img_749.jpg,"Business News: Jerome Powell, Fed Indictment Threat is Trump's 'Political  Pressure' Over Rates"
images/img_750.jpg,"India has been open to making big trade progress, Kevin Hassett says"
images/img_751.jpg,Business News: Empowering India & the world: The Economic Times remains the  undisputed leader in business & financial news segment - The Economic Times
images/img_752.jpg,"Trump-Modi Trade Deal: How Life Changes After India-US Trade Deal | Sanjay  Mookim On Mfg, Markets"
images/img_753.jpg,Top 10 Business Newspapers in India- IRS Readership
images/img_754.jpg,"Business News: Latest Business News, Share Market Today, Gold and Silver  Rates, Markert Analysis and Budget | The Indian Express"
images/img_755.jpg,Business News Today | Tribune India: Economy & Market Updates
images/img_756.jpg,"BreakingNews | India records all-time high 5.4 lakh crore in Diwali sales,  as Swadeshi push and GST relief fuels the retail boom #India #Diwali #Sales  #GST #Swadeshi #Economy #Business"
images/img_757.jpg,"Business News 100 (@businessnews100) • Threads, Say more"
images/img_758.jpg,Indian Business Times - Latest Business News from India
images/img_759.jpg,Business News | Over 95% of EU Businesses in India Plan Expansion in Next 5  Years: FEBI Survey | LatestLY
images/img_760.jpg,"Business News Highlights: Air India hired 9,000 employees in two years,  says Air India chief"
images/img_761.jpg,"Business News, Finance News, India News, Stock Markets BSE/NSE News,  SENSEX, NIFTY, Personal Finance News | Business Standard"
images/img_762.jpg,India's Most Influential Entrepreneurs & Industry-Leading Brands of 2025 by  Entrepreneur News Magazine - The Tribune
images/img_763.jpg,"The Economic Times: Business News, Personal Finance, Financial News, India  Stock Market Investing, Economy News, SENSEX, NIFTY, NSE, BSE Live, IPO News"
images/img_764.jpg,BBC News - India Business Report
images/img_765.jpg,Best Business Newspapers in India in 2025
images/img_766.jpg,Top Business News Websites in India: Business Outreach | PDF
images/img_767.jpg,"India Business News, Latest Business Headlines, Indian Economy, Market News  | Zee Business"
images/img_768.jpg,Economic Times – Institute for Competitiveness
images/img_769.jpg,India's Economy Surges in Jan; FY26 Growth Revised Upward
images/img_770.jpg,Business News | New Report Identifies USD 220 Billion Economic Opportunity  from Clean Air Action in India | LatestLY
images/img_771.jpg,"The Economic Times continues its reign as India’s No.1 Business News  platform, as per ComScore Sep ’25 report, reaffirming the legacy of  credibility, trust and influence that defines us. 🏆📈🇮🇳, This ..."
images/img_772.jpg,"Business News, Finance News, India News, BSE/NSE News, Stock Markets News,  Sensex NIFTY, Union Budget 2023"
images/img_773.jpg,Moneycontrol consolidates leadership as India's largest business news  platform: Mukesh Ambani
images/img_774.jpg,"Company Business News, Indian Companies News, Company Information | Company  News"
images/img_775.jpg,"Business News India | Get the latest news and highlights from Union Budget  2017, business headlines, Stock Market News financial news and analysis of  the indian economy and live updates from the"
images/img_776.jpg,"Business News, Today's Business News Headlines, Share Market News - India  Today"
images/img_777.jpg,"Business News 100 (@businessnews100) • Threads, Say more"
images/img_778.jpg,India Budget 2026: What UAE NRIs and Businesses Can Expect - BizzOpp
images/img_779.jpg,Top Business News Websites in India: Business Outreach | PDF
images/img_780.jpg,"India Business News, Latest Finance News Headlines, Indian Stock Market &  economic news"
images/img_781.jpg,India a bright spot amid global uncertainties: Industry execs | Company  Business News
images/img_782.jpg,Biznews Bharat - Best Indian Business News Portal in the World
images/img_783.jpg,India-US trade deal impact: FPI mood likely to improve - Business News |  The Financial Express
images/img_784.jpg,"Business News Today: Latest Business News, Finance News | The  HinduBusinessLine"
images/img_785.jpg,Moneycontrol beats Economic Times to become business news leader
images/img_786.jpg,A landmark moment for the EU-India partnership - BusinessEurope
images/img_787.jpg,Top Business News Channels GRP in 2025- Aug Update
images/img_788.jpg,India-US trade deal: Brokerages on which stocks may gain the most |  Investment tips | Market news
images/img_789.jpg,India unveils higher spending but no direct measures for the poor | Business  and Economy News | Al Jazeera
images/img_790.jpg,"Business News Today: Business News, Latest News on Business, Business  Headlines and Market Updates - Firstpost"
images/img_791.jpg,Indian Business TV Channels
images/img_792.jpg,"EXCLUSIVE | Haier India eyes third manufacturing unit in India with  proposed investment of Rs 3500 crore, stake sale process also on track |  Video Interview - Companies | ET Now"
images/img_793.jpg,Why Business Journalism is Becoming Popular? | TheHigherEducationReview
images/img_794.jpg,Biznews Bharat - Best Indian Business News Portal in the World
images/img_795.jpg,India–New Zealand Business Forum showcases expanding Bilateral Partnership  and Economic Opportunities - India Shipping News
images/img_796.jpg,"Today News Headlines for School Assembly, February 4, 2026: India-US trade  talks update, renewed Ukraine conflict, and H-1B visa updates"
images/img_797.jpg,"Business News, Finance News, India News, BSE/NSE News, Stock Markets News,  Sensex NIFTY, Union Budget 2023"
images/img_798.jpg,India sends a message – allow talented migrants to come to the UK - BBC News
images/img_799.jpg,"Business News India: Business News Headlines Today - BSE/NSE News, Stock  Markets News, Sensex NIFTY 50 - The Quint"
images/img_800.jpg,"School assembly news headlines, December 23: Top India, world, sports, business  news"
images/img_801.jpg,GIBF News Letter - Global India Business Forum | GIBF
images/img_802.jpg,"India is stealing US jobs, stunting trade growth with unfair practices:  Peter Navarro"
images/img_803.jpg,"Shereen Bhan: Celebrating the defining voice in India's business news. As  the Managing Editor of CNBC-TV18, turns a year older today we take a look  at her accomplishments in the TV news"
images/img_804.jpg,"Business News: Business News India, Business Today, Latest Finance News,  Share Market, Sensex, Business News | Times Now"
images/img_805.jpg,"Rediff Business News - Latest India business news, India Economy news,  World Business, Finance news, Latest business headlines, business videos  and business articles. : personalfinance"
images/img_806.jpg,Just how big is India's 2024 election? Find out in seven numbers | India  Election 2024 News | Al Jazeera
images/img_807.jpg,Modi projected to retain power as voting ends in the last round of India's  election | PBS News
images/img_808.jpg,"India elections 2024: When were they, who could vote and why do they matter?"
images/img_809.jpg,India general election 2019: What happened?
images/img_810.jpg,"Elections begin in India, the world's most populous democracy - ABC News"
images/img_811.jpg,India election 2019: The debunked fake news that keeps coming back
images/img_812.jpg,"What Do the Results of India's Elections Mean? | American University,  Washington, D.C."
images/img_813.jpg,"India to hold seven-phase general election from April 19, results on June 4"
images/img_814.jpg,India election 2024: 18 million first-time voters in India | BBC News
images/img_815.jpg,Just how big is India's 2024 election? Find out in seven numbers | India  Election 2024 News | Al Jazeera
images/img_816.jpg,Hindu nationalist party loses crucial state election ahead of India's  national vote | PBS News
images/img_817.jpg,India elections: All you need to know
images/img_818.jpg,india elections | PBS News
images/img_819.jpg,The Stunning Result in India's Elections | The New Yorker
images/img_820.jpg,India elections 2024: Vote to be held in seven stages | BBC News
images/img_821.jpg,Indian elections underway
images/img_822.jpg,Trump Suggests Biden Meddled in Indian Elections | Vantage on Firstpost |  N18G
images/img_823.jpg,"India exit polls did not capture voter discontent in key states, say  pollsters | Reuters"
images/img_824.jpg,"India elections 2024: When were they, who could vote and why do they matter?"
images/img_825.jpg,Millions vote in India's grueling election with Modi's party likely to win  3rd term | PBS News
images/img_826.jpg,"BJP Tally Down By 57 Seats Compared To 2019 In Hindi Heartland, 41 In  North, 23 In West & 5 In East"
images/img_827.jpg,Four killed as voting kicks off in India's general elections | PBS News
images/img_828.jpg,"Elections begin in India, the world's most populous democracy"
images/img_829.jpg,India's Modi government rushes to regulate AI ahead of national elections | India  Election 2024 News | Al Jazeera
images/img_830.jpg,India general election 2019: What happened?
images/img_831.jpg,India election update | CNN
images/img_832.jpg,Tamil Nadu | The Great Indian Election 2024 | General Elections 2024
images/img_833.jpg,India's latest election embraced AI technology. Here are some ways it was  used constructively | PBS News
images/img_834.jpg,Indian Election Results: Five shocking outcomes for Narendra Modi and the  BJP | India Votes 2024
images/img_835.jpg,India elections 2024: Vote to be held in seven stages
images/img_836.jpg,Narendra Modi claims victory in Indian election - ABC News
images/img_837.jpg,Lok Sabha election 2024: Why India's elections take so long | AP News
images/img_838.jpg,India enters 2nd phase of elections with Kashmir in lockdown | PBS News
images/img_839.jpg,Innovative Election Reporting! Microsoft Start partnered with India today  to bring you unparalleled access to the 2024 Lok Sabha elections in India.  This coverage of the world's largest democratic election includes live
images/img_840.jpg,"Social media, elections and fake news: India edition"
images/img_841.jpg,India's Massive Parliamentary Elections to Begin April 7
images/img_842.jpg,India votes in first phase of marathon election as Modi seeks third term
images/img_843.jpg,Front Pages of Indian and Foreign Newspapers a day after Indian Election  Results. #India #Democracy
images/img_844.jpg,India kicks off the world's largest elections this week. Here's what you  need to know.
images/img_845.jpg,Modi claims victory in closer than expected India election
images/img_846.jpg,India Battles Fake News as Election Heads to Halfway Mark - Bloomberg
images/img_847.jpg,Election: INDIA alliance aiming to take on Narendra Modi's BJP appears to  crack | AP News
images/img_848.jpg,"What an absolute disgrace. Even after their own government's survey  confirmed that people trust EVMs, the @INCKarnataka government has chosen  to push elections back to paper ballots. This is not about reform"
images/img_849.jpg,"Elections begin in India, the world's most populous democracy - ABC News"
images/img_850.jpg,"As India revisits 'One Nation, One Election', these seven countries carry  out simultaneous elections and have been doing so successfully. Read more  via @ndtv [India, electoral model, elections, news, NDTV Profit]"
images/img_851.jpg,Guest Speaker Explains India's Election Year Political Climate - College of  Sciences News - College of Sciences News
images/img_852.jpg,"India has categorically rejected assertions made by the interim government  of #Bangladesh, saying New Delhi has consistently supported free, fair and  inclusive elections in the neighbouring country and has never allowed its"
images/img_853.jpg,"India elections – News, Research and Analysis – The Conversation – page 1"
images/img_854.jpg,Elections in India and the EU mean a flood of homegrown fake news | Nieman  Journalism Lab
images/img_855.jpg,"Among Polling Firms, Only One Got the Indian Elections Right - The New York  Times"
images/img_856.jpg,"Illiterate voters, spread of communism and a staggering success: How the  world saw the first Indian elections | Research News - The Indian Express"
images/img_857.jpg,Interesting facts about Indian Elections #ElectionCommissionOfIndia #ECI  #FactOfTheDay
images/img_858.jpg,What to Know About India's 2024 General Election - The New York Times
images/img_859.jpg,"Nearly 1 billion voters will hit the polls in India's general elections  starting on April 19. Incumbent PM Narendra Modi of the BJP is anticipated  to win, but the opposition bloc, led"
